{
  "schemaVersion": "1.0.0",
  "id": "set-a-agreement",
  "title": "Set A — all sources agree",
  "scenario": "agreement",
  "entity": {
    "name": "Thornwood Seed Library",
    "aliases": ["Thornwood"]
  },
  "documents": [
    "sources/set-a-01.json",
    "sources/set-a-02.json",
    "sources/set-a-03.json",
    "sources/set-a-04.json",
    "sources/set-a-05.json"
  ],
  "expect": {
    "questions": [
      {
        "id": "q-founding",
        "question": "When was the Thornwood Seed Library founded?",
        "status": "agreed",
        "sourceIds": ["set-a-01", "set-a-02", "set-a-03", "set-a-04", "set-a-05"],
        "plantedFact": "All five sources place the founding in 2014, worded five different ways: \"was founded in 2014\", \"established in 2014\", \"operating since 2014\", \"We opened in 2014\", \"has been running in Ashgrove since 2014\". Reporting this as disputed means paraphrase has been mistaken for conflict."
      },
      {
        "id": "q-location",
        "question": "Where is the library based?",
        "status": "agreed",
        "sourceIds": ["set-a-01", "set-a-02", "set-a-03", "set-a-04", "set-a-05"],
        "plantedFact": "Every source places it in Ashgrove. set-a-02 adds the street (Fell Road) and set-a-04 states there has never been a second site; both are narrower than the others but consistent with them, not in conflict."
      },
      {
        "id": "q-collection-size",
        "question": "How many seed varieties does the library hold?",
        "status": "agreed",
        "sourceIds": ["set-a-01", "set-a-02", "set-a-03", "set-a-04", "set-a-05"],
        "plantedFact": "The deliberate false-positive trap for this set. \"more than forty\", \"forty-two varieties\", \"Around forty\", \"somewhere over forty\", and \"forty-odd\" are five different phrasings of one compatible answer. A numerically fuzzy spread is not a contradiction, and this question must stay agreed."
      },
      {
        "id": "q-collection-scope",
        "question": "What kind of seed does the library hold?",
        "status": "agreed",
        "sourceIds": ["set-a-01", "set-a-03"],
        "plantedFact": "Vegetable and herb seed, which set-a-03 specifies as open-pollinated. Only these two sources name the crops; set-a-02, set-a-04 and set-a-05 all say \"varieties\" without saying of what, so none of them is credited here. Crediting one of the three and not the others was the earlier mistake."
      },
      {
        "id": "q-initial-size",
        "question": "How large was the collection when the library opened?",
        "status": "agreed",
        "sourceIds": ["set-a-04"],
        "plantedFact": "About a dozen varieties in a filing cabinet, stated only by set-a-04. A single-source question is still agreed; it is here because a correct run would group it, and leaving it out of the answer key would make that group look like an extra."
      },
      {
        "id": "q-lending-model",
        "question": "How does the library's lending model work?",
        "status": "agreed",
        "sourceIds": ["set-a-01", "set-a-03"],
        "plantedFact": "Members borrow seed and return seed they have saved from their own plots at the end of the season. set-a-01 states the lending half only; set-a-03 states both halves."
      },
      {
        "id": "q-funding",
        "question": "How is the library funded?",
        "status": "agreed",
        "sourceIds": ["set-a-02", "set-a-03", "set-a-04", "set-a-05"],
        "plantedFact": "Member dues plus a regional grant, in all four sources that mention money. set-a-01 is silent on funding, so a run that cites it here has invented support."
      },
      {
        "id": "q-annual-event",
        "question": "What is the library's annual event?",
        "status": "agreed",
        "sourceIds": ["set-a-01", "set-a-02", "set-a-03", "set-a-04", "set-a-05"],
        "plantedFact": "A seed swap held each spring. Deliberately the hardest agreed question in the set: set-a-01 (2019) places it in April in the parish hall and set-a-02 (2021) says it moved outdoors in 2020, which a careful run could read as a venue conflict. It is not one — the document dates resolve it, since both statements are true of different years — and `Claim` has no time-scoping field, so the resolution has to come from the dates rather than the claim text."
      },
      {
        "id": "q-swap-access",
        "question": "Who may attend the seed swap?",
        "status": "agreed",
        "sourceIds": ["set-a-03"],
        "plantedFact": "Open to non-members, stated only by set-a-03."
      },
      {
        "id": "q-swap-attendance",
        "question": "How many people attend the seed swap?",
        "status": "agreed",
        "sourceIds": ["set-a-02"],
        "plantedFact": "Several hundred visitors in 2020, stated only by set-a-02."
      },
      {
        "id": "q-paid-staff",
        "question": "How many paid staff does the library have?",
        "status": "agreed",
        "sourceIds": ["set-a-01", "set-a-02", "set-a-04"],
        "plantedFact": "Two paid staff, phrased as \"Two paid staff\", \"employs two members of staff\", and \"two of us on the payroll\"."
      },
      {
        "id": "q-volunteers",
        "question": "Who does the work the paid staff do not?",
        "status": "agreed",
        "sourceIds": ["set-a-01", "set-a-02", "set-a-04", "set-a-05"],
        "plantedFact": "Volunteers, numbering perhaps thirty across a year (set-a-04 is the only source to give a figure). set-a-01 describes their winter cleaning and packaging rota, set-a-02 says all non-staff work is theirs, and set-a-05 is written by one of them."
      }
    ],
    "requiredSourceIds": ["set-a-01", "set-a-02", "set-a-03", "set-a-04", "set-a-05"],
    "excludedSourceIds": []
  },
  "notes": "Expected outcome: zero disputed groups, every claim cited, all five sources represented. The assertion is that each question below appears in the output with the status given; group *count* is a signal, not a verdict. These questions are pitched finer than `prompts/reconcile.v1.md` calibrates for — it says only to group claims answering the same underlying question — so a run that fuses the three swap questions into one, or reports a fact left unlisted here (seed provenance, \"most of them collected from growers within the valley\" in set-a-01), is behaving reasonably and should be reported rather than failed. The failure this set is really built to catch is over-reporting: the founding-date and collection-size questions are each answered with five different forms of words, so a run that splits either into separate groups has under-merged, and a run that marks either disputed has confused paraphrase with disagreement."
}
